{
  "schema_version": "0.1",
  "target": "1.0",
  "test_policy": {
    "live_agent_model_tests": "deferred_until_implementation_complete",
    "automatic_live_dispatch": false
  },
  "items": [
    {
      "id": "task_contracts",
      "title": "Portable task boundaries and contract compatibility",
      "definition": "complete",
      "implementation": "complete",
      "offline_coverage": "complete",
      "definition_refs": [
        "docs/contracts.md",
        "schemas/task-v0.2.schema.json"
      ],
      "implementation_refs": [
        "loop_engineering/contracts.py",
        "reference/core.py"
      ],
      "test_refs": [
        "tests/test_core.py",
        "tests/test_engine.py"
      ],
      "remaining_work": null
    },
    {
      "id": "proposal_bridge",
      "title": "Model-neutral proposals and guarded file edits",
      "definition": "complete",
      "implementation": "complete",
      "offline_coverage": "complete",
      "definition_refs": [
        "schemas/step-v0.2.schema.json",
        "docs/local-controller.md",
        "schemas/step-v0.3.schema.json",
        "docs/execution-tools.zh-CN.md"
      ],
      "implementation_refs": [
        "loop_engineering/contracts.py",
        "loop_engineering/controller.py",
        "loop_engineering/workspace.py",
        "loop_engineering/file_changes.py"
      ],
      "test_refs": [
        "tests/test_engine.py",
        "tests/test_file_operations.py"
      ],
      "remaining_work": null
    },
    {
      "id": "completion_gate",
      "title": "Deterministic contract, snapshot, environment, and check gate",
      "definition": "complete",
      "implementation": "complete",
      "offline_coverage": "complete",
      "definition_refs": [
        "docs/verification.md",
        "schemas/evidence.schema.json"
      ],
      "implementation_refs": [
        "reference/core.py",
        "loop_engineering/controller.py"
      ],
      "test_refs": [
        "tests/test_core.py",
        "tests/test_engine.py"
      ],
      "remaining_work": null
    },
    {
      "id": "snapshots_recovery",
      "title": "Content-addressed checkpoints and guarded file-journal recovery",
      "definition": "complete",
      "implementation": "complete",
      "offline_coverage": "complete",
      "definition_refs": [
        "docs/local-controller.md",
        "docs/architecture.md",
        "docs/execution-tools.zh-CN.md"
      ],
      "implementation_refs": [
        "loop_engineering/workspace.py",
        "loop_engineering/controller.py",
        "loop_engineering/store.py",
        "loop_engineering/file_changes.py",
        "loop_engineering/provision.py"
      ],
      "test_refs": [
        "tests/test_engine.py",
        "tests/test_file_operations.py",
        "tests/test_provisioning.py",
        "tests/test_team_executors.py"
      ],
      "remaining_work": null
    },
    {
      "id": "bounded_processes",
      "title": "Local process timeouts, owned-group cancellation, and unknown-effect reconciliation",
      "definition": "complete",
      "implementation": "complete",
      "offline_coverage": "complete",
      "definition_refs": [
        "docs/local-controller.md"
      ],
      "implementation_refs": [
        "loop_engineering/processes.py",
        "loop_engineering/controller.py"
      ],
      "test_refs": [
        "tests/test_processes.py",
        "tests/test_engine.py"
      ],
      "remaining_work": null
    },
    {
      "id": "lifecycle_control",
      "title": "Full lifecycle, pause, authorized amendments, and consistent resource deadlines",
      "definition": "complete",
      "implementation": "complete",
      "offline_coverage": "complete",
      "definition_refs": [
        "docs/architecture.md",
        "schemas/state.schema.json",
        "docs/native-engine.md",
        "schemas/native.schema.json"
      ],
      "implementation_refs": [
        "loop_engineering/controller.py",
        "loop_engineering/native_engine.py",
        "loop_engineering/cli.py"
      ],
      "test_refs": [
        "tests/test_engine.py",
        "tests/test_native.py"
      ],
      "remaining_work": null
    },
    {
      "id": "protected_runtime",
      "title": "Process containment and verified runtime capabilities",
      "definition": "complete",
      "implementation": "complete",
      "offline_coverage": "complete",
      "definition_refs": [
        "docs/architecture.md",
        "docs/adapters.md",
        "schemas/runtime.schema.json",
        "docs/native-engine.md",
        "schemas/native.schema.json"
      ],
      "implementation_refs": [
        "loop_engineering/runtime.py",
        "loop_engineering/processes.py",
        "loop_engineering/native_engine.py"
      ],
      "test_refs": [
        "tests/test_native.py",
        "tests/test_processes.py"
      ],
      "remaining_work": null
    },
    {
      "id": "typed_broker",
      "title": "Typed tool registry, authorization decisions, and reconciled action results",
      "definition": "complete",
      "implementation": "complete",
      "offline_coverage": "complete",
      "definition_refs": [
        "docs/contracts.md",
        "docs/architecture.md",
        "docs/native-engine.md",
        "schemas/native.schema.json"
      ],
      "implementation_refs": [
        "loop_engineering/broker.py",
        "loop_engineering/native_engine.py"
      ],
      "test_refs": [
        "tests/test_native.py",
        "tests/test_engine.py"
      ],
      "remaining_work": null
    },
    {
      "id": "authenticated_evidence",
      "title": "Evidence origin, protected artifact storage, and independent-review identity",
      "definition": "complete",
      "implementation": "complete",
      "offline_coverage": "complete",
      "definition_refs": [
        "docs/verification.md",
        "schemas/evidence.schema.json",
        "docs/native-engine.md",
        "schemas/native.schema.json"
      ],
      "implementation_refs": [
        "loop_engineering/authority.py",
        "loop_engineering/store.py",
        "loop_engineering/evaluators.py",
        "loop_engineering/native_engine.py"
      ],
      "test_refs": [
        "tests/test_native.py",
        "tests/test_engine.py"
      ],
      "remaining_work": null
    },
    {
      "id": "hard_spend_reservations",
      "title": "Conservative token and cost reservations across dispatch, retry, and recovery",
      "definition": "complete",
      "implementation": "complete",
      "offline_coverage": "complete",
      "definition_refs": [
        "docs/adapters.md",
        "docs/architecture.md",
        "docs/contracts.md",
        "docs/native-engine.md",
        "schemas/native.schema.json"
      ],
      "implementation_refs": [
        "loop_engineering/budgets.py",
        "loop_engineering/models.py",
        "loop_engineering/native_engine.py"
      ],
      "test_refs": [
        "tests/test_native.py",
        "tests/test_http_worker.py"
      ],
      "remaining_work": null
    },
    {
      "id": "native_model_drivers",
      "title": "Native provider interface and direct model drivers",
      "definition": "complete",
      "implementation": "complete",
      "offline_coverage": "complete",
      "definition_refs": [
        "docs/adapters.md",
        "schemas/adapter.schema.json",
        "docs/native-engine.md",
        "schemas/native.schema.json"
      ],
      "implementation_refs": [
        "loop_engineering/models.py",
        "loop_engineering/native_contracts.py",
        "scripts/http_worker.py",
        "loop_engineering/native_engine.py",
        "loop_engineering/output_schema.py"
      ],
      "test_refs": [
        "tests/test_native.py",
        "tests/test_http_worker.py",
        "tests/test_output_schema.py"
      ],
      "remaining_work": null
    },
    {
      "id": "external_evaluators",
      "title": "Required review, human, interaction, and artifact checks",
      "definition": "complete",
      "implementation": "complete",
      "offline_coverage": "complete",
      "definition_refs": [
        "docs/verification.md",
        "docs/architecture.md",
        "schemas/task-v0.2.schema.json",
        "docs/native-engine.md",
        "schemas/native.schema.json",
        "schemas/execution-tools.schema.json",
        "docs/execution-tools.zh-CN.md",
        "docs/native-review.zh-CN.md"
      ],
      "implementation_refs": [
        "loop_engineering/evaluators.py",
        "loop_engineering/authority.py",
        "loop_engineering/native_engine.py",
        "loop_engineering/cli.py",
        "loop_engineering/external_execution.py",
        "loop_engineering/execution_tools.py",
        "scripts/browser_check.cjs",
        "scripts/execute_check.py",
        "loop_engineering/native_review.py",
        "loop_engineering/native_preflight.py",
        "loop_engineering/native_host.py"
      ],
      "test_refs": [
        "tests/test_native.py",
        "tests/test_execution_tools.py",
        "tests/test_external_execution.py",
        "tests/test_team_executors.py",
        "tests/test_native_review.py",
        "tests/test_native_preflight.py"
      ],
      "remaining_work": null
    },
    {
      "id": "staged_workflow",
      "title": "Dependency-aware slices and final integrated verification",
      "definition": "complete",
      "implementation": "complete",
      "offline_coverage": "complete",
      "definition_refs": [
        "docs/architecture.md",
        "LOOP.md",
        "docs/native-engine.md",
        "schemas/native.schema.json",
        "docs/native-review.zh-CN.md"
      ],
      "implementation_refs": [
        "loop_engineering/stages.py",
        "loop_engineering/native_engine.py",
        "loop_engineering/native_plan_repair.py",
        "loop_engineering/team_engine.py",
        "loop_engineering/team_automation.py"
      ],
      "test_refs": [
        "tests/test_native.py",
        "tests/test_native_plan_repair.py",